{
  "schemaVersion": "1",
  "kind": "language-pack",
  "id": "rust",
  "displayName": "Rust",
  "version": "1.0.0",
  "description": "Rust language support for AICD",
  "runtime": {
    "configFile": ".<brand>.json",
    "genericWorkspaceRoot": ".agents",
    "nativeWorkspaceRoot": ".<brand>",
    "projectMarkers": ["Cargo.toml", "src/main.rs"]
  },
  "templates": {
    "base": "template/base"
  },
  "supports": {
    "init": true,
    "featureAdd": true,
    "doctor": true
  },
  "featureRegistry": "features/registry.json",
  "compatibility": {
    "cli": "^1.0.0"
  }
}
